Question,Answer
"How can I reset my password?","You can reset your password by clicking 'Forgot Password' on the login page."
"How do I check my order status?","Go to 'My Orders' section and select your order to see the current status."
"What payment methods are accepted?","We accept credit cards, debit cards, UPI, and PayPal."
"Can I return a product?","Yes, you can request a return within 7 days of delivery from your account section."
"How to contact customer support?","You can reach us via email at support@example.com or call 1800-123-456."
